"Maternal Health Neonatology Perinatology","Maternal Health, Neonatology and Perinatology","E OA C",40748,,"2054-958X","BioMed Central","English",1,"2",1,"Fully Open Access","Available in electronic format only. Open Access. "
"Mathematical Geosciences","Mathematical Geosciences","PE OF",11004,"1874-8961","1874-8953","Springer","English",1,"48",8,"Hybrid (Open Choice)",
"Mathematical Intelligencer","The Mathematical Intelligencer","PE OF",283,"0343-6993","1866-7414","Springer","English",1,"38",4,"Hybrid (Open Choice)",
"Mathematical Methods Operations Research","Mathematical Methods of Operations Research","PE OF",186,"1432-2994","1432-5217","Springer","English",2,"83-84",3,"Hybrid (Open Choice)",
"Mathematical Methods Statistics","Mathematical Methods of Statistics","PE",12004,"1066-5307","1934-8045","Allerton Press","English",1,"25",4,,"Russian Library of Science. "
"Mathematical Models Computer Simulations","Mathematical Models and Computer Simulations","PE",12608,"2070-0482","2070-0490","MAIK Nauka/Interperiodica","English",1,"8",6,,"Russian Library of Science. "
"Mathematical Notes","Mathematical Notes","PE",11006,"0001-4346","1573-8876","MAIK Nauka/Interperiodica","English",2,"99-100",6,,"Erratum Journals List: Publishes 2 volumes with 6 issues. Russian Library of Science. "
"Mathematical Physics Analysis Geometry","Mathematical Physics, Analysis and Geometry","E C",11040,,"1572-9656","Springer","English",1,"19",4,"Hybrid (Open Choice)","Available in electronic format only. "
"Mathematical Programming","Mathematical Programming","PE OF S",10107,"0025-5610","1436-4646","Springer","English",6,"155-160",2,"Hybrid (Open Choice)",
"Mathematical Programming Computation","Mathematical Programming Computation","PE OF S",12532,"1867-2949","1867-2957","Springer","English",1,"8",4,"Hybrid (Open Choice)",
"Mathematical Sciences","Mathematical Sciences","E OA OF",40096,,"2251-7456","Springer","English",1,"10",4,"Fully Open Access","Available in electronic format only. Open Access. "
"Mathematics Computer Science","Mathematics in Computer Science","PE OF",11786,"1661-8270","1661-8289","Birkhäuser","English",1,"10",4,"Hybrid (Open Choice)",
"Mathematics Control Signals Systems","Mathematics of Control, Signals, and Systems","PE C",498,,"1435-568X","Springer","English",1,"28",4,"Hybrid (Open Choice)",
"Mathematics Education Research Journal","Mathematics Education Research Journal","PE OF",13394,"1033-2170","2211-050X","Springer","English",1,"28",4,"Hybrid (Open Choice)",
"Mathematics Financial Economics","Mathematics and Financial Economics","PE OF S",11579,"1862-9679","1862-9660","Springer","English",1,"10",4,"Hybrid (Open Choice)",
"Mathematics-in-Industry Case Studies","Mathematics-in-Industry Case Studies","E OA C",40929,,"1913-4967","Springer","English",1,"7",1,"Fully Open Access","Take-over, content expected in 2016. Former publisher: The Fields Institute for Research in Mathematical Sciences. Available in electronic format only. Open Access. "
"Mathematische Annalen","Mathematische Annalen","PE OF S",208,"0025-5831","1432-1807","Springer","English",3,"364-366",4,"Hybrid (Open Choice)",
"Mathematische Semesterberichte","Mathematische Semesterberichte","PE OF",591,"0720-728X","1432-1815","Springer","German",1,"63",2,"Hybrid (Open Choice)",
"Mathematische Zeitschrift","Mathematische Zeitschrift","PE OF S",209,"0025-5874","1432-1823","Springer","English",3,"282-284",4,"Hybrid (Open Choice)",
"Maxillofacial Plastic Reconstructive Surgery","Maxillofacial Plastic and Reconstructive Surgery","E OA C",40902,,"2288-8586","Springer","English",1,"38",1,"Fully Open Access","Available in electronic format only. Open Access. "
"Measurement Techniques","Measurement Techniques","PE",11018,"0543-1972","1573-8906","Springer","English",1,"59",12,,"Russian Library of Science. "
"Meccanica","Meccanica","PE OF",11012,"0025-6455","1572-9648","Springer","English",1,"51",12,"Hybrid (Open Choice)",
"Mechanics Advanced Materials Modern Processes","Mechanics of Advanced Materials and Modern Processes","E OA S C",40759,,"2198-7874","Springer","English",1,"2",1,"Fully Open Access","New Start, content expected in 2015. Available in electronic format only. Open Access. "
"Mechanics Composite Materials","Mechanics of Composite Materials","PE",11029,"0191-5665","1573-8922","Springer","English",1,"52",6,,"Russian Library of Science. "
"Mechanics Solids","Mechanics of Solids","PE",11964,"0025-6544","1934-7936","Allerton Press","English",1,"51",6,,"Russian Library of Science. "
"Mechanics Time-Dependent Materials","Mechanics of Time-Dependent Materials","PE OF",11043,"1385-2000","1573-2738","Springer","English",1,"20",4,"Hybrid (Open Choice)",
"Médecine Chirurgie Pied","Médecine et Chirurgie du Pied","E OF",10243,,"1765-2855","Lavoisier","French",1,"32",4,"Hybrid (Open Choice)","Springerlink licensing permitted (last year 2016). Print and online subscriptions available from Lavoisier. "
"Medical Biological Engineering Computing","Medical & Biological Engineering & Computing","PE",11517,"0140-0118","1741-0444","Springer","English",1,"54",12,"Hybrid (Open Choice)",
"Medical Gas Research","Medical Gas Research","E OA C",13618,,"2045-9912","BioMed Central","English",,,,"Fully Open Access","Erratum Journals List: No longer published by Springer as of completion of Volume 5 (2015). "
"Medical Microbiology Immunology","Medical Microbiology and Immunology","PE OF S",430,"0300-8584","1432-1831","Springer","English",1,"205",6,"Hybrid (Open Choice)",
"Medical Molecular Morphology","Medical Molecular Morphology","PE OF S",795,"1860-1480","1860-1499","Springer","English",1,"49",4,,
"Medical Oncology","Medical Oncology","E C",12032,,"1559-131X","Springer","English",1,"33",12,"Hybrid (Open Choice)","Available in electronic format only. "
"Medical Science Educator","Medical Science Educator","E OF",40670,,"2156-8650","Springer","English",1,"26",4,"Hybrid (Open Choice)","Available in electronic format only. "
"Medicinal Chemistry Research","Medicinal Chemistry Research","PE OF S",44,"1054-2523","1554-8120","Springer","English",1,"25",12,"Hybrid (Open Choice)",
"Medicine Health Care Philosophy","Medicine, Health Care and Philosophy","PE OF",11019,"1386-7423","1572-8633","Springer","English",1,"19",4,"Hybrid (Open Choice)",
"Mediterranean Journal Mathematics","Mediterranean Journal of Mathematics","PE",9,"1660-5446","1660-5454","Birkhäuser","English",1,"13",6,"Hybrid (Open Choice)",
"medizinische genetik","medizinische genetik","PE OF S",11825,"0936-5931","1863-5490","SpringerMedizin","German",1,"28",4,"Hybrid (Open Choice)",
"Medizinische Klinik Intensivmedizin Notfallmedizin","Medizinische Klinik - Intensivmedizin und Notfallmedizin","PE OF S",63,"2193-6218","2193-6226","SpringerMedizin","German",1,"111",8,"Hybrid (Open Choice)",
"Medizinrecht","Medizinrecht","PE",350,"0723-8886","1433-8629","Springer","German",1,"34",12,"Hybrid (Open Choice)",
"Mednet","Mednet","PE",12462,"1568-7716","1876-5963","Bohn Stafleu van Loghum","Dutch",,,,,"As of 2015 continued as Praktische Huisartsgeneeskunde (project id 41045). "
"Memetic Computing","Memetic Computing","E OF S",12293,,"1865-9292","Springer","English",1,"8",4,"Hybrid (Open Choice)","Available in electronic format only. "
"memo Magazine European Medical Oncology","memo - Magazine of European Medical Oncology","PE OF",12254,"1865-5041","1865-5076","SpringerMedizin","English",1,"9",4,"Hybrid (Open Choice)","Order through Springer Vienna. "
"Memory Cognition","Memory & Cognition","PE OF S",13421,"0090-502X","1532-5946","Springer","English",1,"44",8,"Hybrid (Open Choice)",
"Metabolic Brain Disease","Metabolic Brain Disease","PE OF",11011,"0885-7490","1573-7365","Springer","English",1,"31",6,"Hybrid (Open Choice)",
"Metabolomics","Metabolomics","PE OF S C",11306,"1573-3882","1573-3890","Springer","English",1,"12",12,"Hybrid (Open Choice)","Erratum Journals List: Publishes 12 issues in 2016. "
"Metacognition Learning","Metacognition and Learning","PE OF",11409,"1556-1623","1556-1631","Springer","English",1,"11",3,"Hybrid (Open Choice)",
"Metal Science Heat Treatment","Metal Science and Heat Treatment","PE",11041,"0026-0673","1573-8973","Springer","English",1,"58",12,,"Russian Library of Science. "
"Metallography Microstructure Analysis","Metallography, Microstructure, and Analysis","PE OF",13632,"2192-9262","2192-9270","Springer","English",1,"5",6,"Hybrid (Open Choice)",
"Metallurgical Materials Transactions A","Metallurgical and Materials Transactions A","PE OF",11661,"1073-5623","1543-1940","Springer","English",1,"47",12,"Hybrid (Open Choice)",
"Metallurgical Materials Transactions A B","Metallurgical and Materials Transactions A+B","PE",11835,,,"Springer","English",,,,,"Combined subscription. "
"Metallurgical Materials Transactions B","Metallurgical and Materials Transactions B","PE OF",11663,"1073-5615","1543-1916","Springer","English",1,"47",6,"Hybrid (Open Choice)",
"Metallurgical Materials Transactions E","Metallurgical and Materials Transactions E","PE OF",40553,"2196-2936","2196-2944","Springer","English",1,"3",4,"Hybrid (Open Choice)",
"Metallurgist","Metallurgist","PE",11015,"0026-0894","1573-8892","Springer","English",1,"60",12,,"Russian Library of Science. "
"Metals Materials International","Metals and Materials International","PE",12540,"1598-9623","2005-4149","The Korean Institute of Metals and Materials, co-published with Springer","English",1,"22",6,,"Springer has the exclusive distribution rights for print version outside Korea, for electronic version worldwide. "
"Metascience","Metascience","PE OF",11016,"0815-0796","1467-9981","Springer","English",1,"25",3,"Hybrid (Open Choice)",
"Meteorology Atmospheric Physics","Meteorology and Atmospheric Physics","PE OF S",703,"0177-7971","1436-5065","Springer","English",1,"128",6,"Hybrid (Open Choice)",
"Methodology Computing Applied Probability","Methodology and Computing in Applied Probability","PE OF",11009,"1387-5841","1573-7713","Springer","English",1,"18",4,"Hybrid (Open Choice)",
"Metrika","Metrika","PE OF",184,"0026-1335","1435-926X","Springer","English",1,"79",8,"Hybrid (Open Choice)",
"METRON","METRON","PE OF",40300,"0026-1424","2281-695X","Springer","English",1,"74",3,"Hybrid (Open Choice)",
"Micro Nano Systems Letters","Micro and Nano Systems Letters","E OA C",40486,,"2213-9621","The Society of Micro and Nano Systems, co-published with Springer","English",1,"4",1,"Fully Open Access","Available in electronic format only. Open Access. "
"Microbial Cell Factories","Microbial Cell Factories","E OA C",12934,,"1475-2859","BioMed Central","English",1,"15",1,"Fully Open Access","Available in electronic format only. Open Access. "
"Microbial Ecology","Microbial Ecology","PE OF S",248,"0095-3628","1432-184X","Springer","English",2,"71-72",4,"Hybrid (Open Choice)",
"Microbiology","Microbiology","PE",11021,"0026-2617","1608-3237","MAIK Nauka/Interperiodica","English",1,"85",6,,"Russian Library of Science. "
"Microbiome","Microbiome","E OA C",40168,,"2049-2618","BioMed Central","English",1,"4",1,"Fully Open Access","Available in electronic format only. Open Access. "
"Microchimica Acta","Microchimica Acta","PE OF",604,"0026-3672","1436-5073","Springer","English",1,"183",12,"Hybrid (Open Choice)",
"Microfluidics Nanofluidics","Microfluidics and Nanofluidics","PE C",10404,"1613-4982","1613-4990","Springer","English",1,"20",12,"Hybrid (Open Choice)",
"Microgravity Science Technology","Microgravity Science and Technology","PE OF S",12217,"0938-0108","1875-0494","Springer","English",1,"28",6,"Hybrid (Open Choice)",
"Microsystem Technologies","Microsystem Technologies","PE OF",542,"0946-7076","1432-1858","Springer","English",1,"22",12,"Hybrid (Open Choice)",
"Milan Journal Mathematics","Milan Journal of Mathematics","PE OF",32,"1424-9286","1424-9294","Birkhäuser","English",1,"84",2,"Hybrid (Open Choice)",
"Military Medical Research","Military Medical Research","E OA C",40779,,"2054-9369","BioMed Central","English",1,"3",1,"Fully Open Access","Available in electronic format only. Open Access. "
"Mind Society","Mind & Society","PE OF",11299,"1593-7879","1860-1839","Springer","English",1,"15",2,"Hybrid (Open Choice)",
"Mindfulness","Mindfulness","PE OF",12671,"1868-8527","1868-8535","Springer","English",1,"7",6,"Hybrid (Open Choice)",
"Minds Machines","Minds and Machines","PE OF",11023,"0924-6495","1572-8641","Springer","English",1,"26",4,"Hybrid (Open Choice)",
"Mine Water Environment","Mine Water and the Environment","PE OF",10230,"1025-9112","1616-1068","Springer","English",1,"35",4,"Hybrid (Open Choice)",
"Mineral Economics","Mineral Economics","PE OF S",13563,"2191-2203","2191-2211","Springer","English",1,"29",3,"Hybrid (Open Choice)",
"Mineralium Deposita","Mineralium Deposita","PE OF S",126,"0026-4598","1432-1866","Springer","English",1,"51",8,"Hybrid (Open Choice)",
"Mineralogy Petrology","Mineralogy and Petrology","PE OF",710,"0930-0708","1438-1168","Springer","English",1,"110",6,"Hybrid (Open Choice)",
"Minerva","Minerva","PE OF",11024,"0026-4695","1573-1871","Springer","English",1,"54",4,"Hybrid (Open Choice)",
"Mitigation Adaptation Strategies Global Change","Mitigation and Adaptation Strategies for Global Change","PE OF S",11027,"1381-2386","1573-1596","Springer","English",1,"21",8,"Hybrid (Open Choice)",
"MKG-Chirurg","Der MKG-Chirurg","PE OF S",12285,"1865-9659","1865-9667","SpringerMedizin","German",1,"9",4,"Hybrid (Open Choice)",
"MMW Fortschritte Medizin","MMW - Fortschritte der Medizin","PE",15006,"1438-3276","1613-3560","SpringerMedizin","German",1,"158",22,,"Available on link.springer.com and springermedizin.de. "
"Mobile DNA","Mobile DNA","E OA C",13100,,"1759-8753","BioMed Central","English",1,"7",1,"Fully Open Access","Available in electronic format only. Open Access. "
"Mobile Networks Applications","Mobile Networks and Applications","PE OF",11036,"1383-469X","1572-8153","Springer","English",1,"21",6,"Hybrid (Open Choice)",
"Modeling Earth Systems Environment","Modeling Earth Systems and Environment","E",40808,,"2363-6211","Springer","English",1,"2",4,"Hybrid (Open Choice)","Available in electronic format only. "
"Molecular Autism","Molecular Autism","E OA C",13229,,"2040-2392","BioMed Central","English",1,"7",1,"Fully Open Access","Available in electronic format only. Open Access. "
"Molecular Biology","Molecular Biology","PE",11008,"0026-8933","1608-3245","MAIK Nauka/Interperiodica","English",1,"50",6,,"Russian Library of Science. "
"Molecular Biology Reports","Molecular Biology Reports","E OF S",11033,,"1573-4978","Springer","English",1,"43",12,"Hybrid (Open Choice)","Available in electronic format only. "
"Molecular Biotechnology","Molecular Biotechnology","E OF",12033,,"1559-0305","Humana Press","English",1,"58",12,"Hybrid (Open Choice)","Available in electronic format only. "
"Molecular Brain","Molecular Brain","E OA C",13041,,"1756-6606","BioMed Central","English",1,"9",1,"Fully Open Access","Available in electronic format only. Open Access. "
"Molecular Breeding","Molecular Breeding","PE S C",11032,"1380-3743","1572-9788","Springer","English",1,"36",12,"Hybrid (Open Choice)",
"Molecular Cancer","Molecular Cancer","E OA C",12943,,"1476-4598","BioMed Central","English",1,"15",1,"Fully Open Access","Available in electronic format only. Open Access. "
"Molecular Cellular Biochemistry","Molecular and Cellular Biochemistry","PE OF",11010,"0300-8177","1573-4919","Springer","English",13,"411-423",2,"Hybrid (Open Choice)",
"Molecular Cellular Pediatrics","Molecular and Cellular Pediatrics","E OA OF C",40348,,"2194-7791","Springer","English",1,"3",1,"Fully Open Access","Available in electronic format only. Open Access. "
"Molecular Cellular Therapies","Molecular and Cellular Therapies","E OA C",40591,,"2052-8426","BioMed Central","English",1,"4",1,"Fully Open Access","Available in electronic format only. Open Access. "
"Molecular Cellular Toxicology","Molecular & Cellular Toxicology","PE",13273,"1738-642X","2092-8467","The Korean Society of Toxicogenomics and Toxicoproteomics, co-published with Springer","English",1,"12",4,,"Springer has the exclusive distribution rights for print version outside Korea, for electronic version worldwide. "
"Molecular Cytogenetics","Molecular Cytogenetics","E OA C",13039,,"1755-8166","BioMed Central","English",1,"9",1,"Fully Open Access","Available in electronic format only. Open Access. "
"Molecular Diagnosis Therapy","Molecular Diagnosis & Therapy","PE OF",40291,"1177-1062","1179-2000","Adis","English",1,"20",6,"Hybrid (Open Choice)",
"Molecular Diversity","Molecular Diversity","E OF",11030,,"1573-501X","Springer","English",1,"20",4,"Hybrid (Open Choice)","Available in electronic format only. "
"Molecular Genetics Genomics","Molecular Genetics and Genomics","PE OF S",438,"1617-4615","1617-4623","Springer","English",1,"291",6,"Hybrid (Open Choice)",
"Molecular Genetics Microbiology Virology","Molecular Genetics, Microbiology and Virology","PE",11965,"0891-4168","1934-841X","Allerton Press","English",1,"31",4,,"Russian Library of Science. "
"Molecular Imaging Biology","Molecular Imaging and Biology","PE OF",11307,"1536-1632","1860-2002","Springer","English",1,"18",6,"Hybrid (Open Choice)",
"Molecular Neurobiology","Molecular Neurobiology","PE OF",12035,"0893-7648","1559-1182","Springer","English",1,"53",10,"Hybrid (Open Choice)",
"Molecular Neurodegeneration","Molecular Neurodegeneration","E OA C",13024,,"1750-1326","BioMed Central","English",1,"11",1,"Fully Open Access","Available in electronic format only. Open Access. "
"Molecular Pain","Molecular Pain","E OA C",12990,,"1744-8069","BioMed Central","English",,,,"Fully Open Access","Erratum Journals List: No longer published / distributed by Biomed Central. New publisher: Sage. "
"Monash Bioethics Review","Monash Bioethics Review","PE OF",40592,"1321-2753","1836-6716","Springer","English",1,"34",4,"Hybrid (Open Choice)",
"Monatshefte Chemie Chemical Monthly","Monatshefte für Chemie - Chemical Monthly","PE OF",706,"0026-9247","1434-4475","Springer","English",1,"147",12,"Hybrid (Open Choice)",
"Monatshefte Mathematik","Monatshefte für Mathematik","PE OF S",605,"0026-9255","1436-5081","Springer","English",3,"179-181",4,"Hybrid (Open Choice)",
"Monatsschrift Kinderheilkunde","Monatsschrift Kinderheilkunde","PE OF",112,"0026-9298","1433-0474","SpringerMedizin","German",1,"164",12,"Hybrid (Open Choice)",
"Mondhygienisten vademecum","Mondhygienisten vademecum","PE",12465,"1571-053X","1876-5947","Bohn Stafleu van Loghum","Dutch",1,"14",12,,"All content freely available. Order through Bohn Stafleu van Loghum. Free subscription available. "
"Morphology","Morphology","PE OF",11525,"1871-5621","1871-5656","Springer","English",1,"26",4,"Hybrid (Open Choice)",
"Moscow University Biological Sciences Bulletin","Moscow University Biological Sciences Bulletin","PE",11966,"0096-3925","1934-791X","Allerton Press","English",1,"71",4,,"Russian Library of Science. "
"Moscow University Chemistry Bulletin","Moscow University Chemistry Bulletin","PE",11967,"0027-1314","1935-0260","Allerton Press","English",1,"71",6,,"Russian Library of Science. "
"Moscow University Computational Mathematics Cybernetics","Moscow University Computational Mathematics and Cybernetics","PE",11968,"0278-6419","1934-8428","Allerton Press","English",1,"40",4,,"Russian Library of Science. "
"Moscow University Geology Bulletin","Moscow University Geology Bulletin","PE",11969,"0145-8752","1934-8436","Allerton Press","English",1,"71",6,,"Russian Library of Science. "
"Moscow University Mathematics Bulletin","Moscow University Mathematics Bulletin","PE",11970,"0027-1322","1934-8444","Allerton Press","English",1,"71",6,,"Russian Library of Science. "
"Moscow University Mechanics Bulletin","Moscow University Mechanics Bulletin","PE",11971,"0027-1330","1934-8452","Allerton Press","English",1,"71",6,,"Russian Library of Science. "
"Moscow University Physics Bulletin","Moscow University Physics Bulletin","PE",11972,"0027-1349","1934-8460","Allerton Press","English",1,"71",6,,"Russian Library of Science. "
"Moscow University Soil Science Bulletin","Moscow University Soil Science Bulletin","PE",11973,"0147-6874","1934-7928","Allerton Press","English",1,"71",5,,"Russian Library of Science. "
"Motivation Emotion","Motivation and Emotion","PE OF",11031,"0146-7239","1573-6644","Springer","English",1,"40",6,"Hybrid (Open Choice)",
"Movement Ecology","Movement Ecology","E OA C",40462,,"2051-3933","BioMed Central","English",1,"4",1,"Fully Open Access","Available in electronic format only. Open Access. "
"MTZ industrial","MTZ industrial","PE",40353,"2194-8682","2194-8690","Springer Vieweg","English",1,"6",3,,"Erratum Journals List: Price amendment. Electronic version available on springerprofessional.de and link.springer.com. E-only subscription not available, SpringerLink licensing permitted outside the DACH countries. "
"MTZ Motortechnische Zeitschrift","MTZ - Motortechnische Zeitschrift","PE",35146,"0024-8525","2192-8843","Springer Vieweg","German",1,"77",12,,"Erratum Journals List: 2nd Price amendment. Subscription to MTZ includes subscription to ATZextra. Electronic version available on springerprofessional.de and link.springer.com. E-only subscription not available, SpringerLink licensing permitted outside the DACH countries. "
"MTZ worldwide","MTZ worldwide","E",38313,,"2192-9114","Springer Vieweg","English",1,"77",12,,"Erratum Journals list: Price amendment. Electronic version available on springerprofessional.de and link.springer.com. Available in electronic format only. "
"Multibody System Dynamics","Multibody System Dynamics","PE OF",11044,"1384-5640","1573-272X","Springer","English",3,"36-38",4,"Hybrid (Open Choice)",
"Multidimensional Systems Signal Processing","Multidimensional Systems and Signal Processing","PE OF",11045,"0923-6082","1573-0824","Springer","English",1,"27",4,"Hybrid (Open Choice)",
"Multidisciplinary Respiratory Medicine","Multidisciplinary Respiratory Medicine","E OA C",40248,,"2049-6958","BioMed Central","English",1,"11",1,"Fully Open Access","Available in electronic format only. Open Access. "
"Multilingual Education","Multilingual Education","E OA S C",13616,,"2191-5059","Springer","English",1,"6",1,"Fully Open Access","Available in electronic format only. Open Access. "
"Multimedia Systems","Multimedia Systems","PE OF",530,"0942-4962","1432-1882","Springer","English",1,"22",6,"Hybrid (Open Choice)",
"Multimedia Tools Applications","Multimedia Tools and Applications","PE OF",11042,"1380-7501","1573-7721","Springer","English",1,"75",24,"Hybrid (Open Choice)",
"Multiple Sclerosis Demyelinating Disorders","Multiple Sclerosis and Demyelinating Disorders","E OA C",40893,,"2056-6115","BioMed Central","English",1,"1",1,"Fully Open Access","New Start, content expected in 2016. Available in electronic format only. Open Access. "
"MUSCULOSKELETAL SURGERY","MUSCULOSKELETAL SURGERY","E OF S",12306,,"2035-5114","Springer","English",1,"100",3,"Hybrid (Open Choice)","Available in electronic format only. "
"mUX Journal Mobile User Experience","mUX: The Journal of Mobile User Experience","E OA C",13678,,"2196-873X","Springer","English",1,"5",1,"Fully Open Access","Available in electronic format only. Open Access. "
"Mycological Progress","Mycological Progress","E S C",11557,,"1861-8952","Springer","English",1,"15",12,"Hybrid (Open Choice)","Available in electronic format only. "
"Mycopathologia","Mycopathologia","PE OF S",11046,"0301-486X","1573-0832","Springer","English",1,"181",12,"Hybrid (Open Choice)",
"Mycorrhiza","Mycorrhiza","PE OF S",572,"0940-6360","1432-1890","Springer","English",1,"26",8,"Hybrid (Open Choice)",
"Mycotoxin Research","Mycotoxin Research","PE OF S",12550,"0178-7888","1867-1632","Springer","English",1,"32",4,"Hybrid (Open Choice)",
"Nano Convergence","Nano Convergence","E OA C",40580,,"2196-5404","Korea Nano Technology Research Society, co-published with Springer","English",1,"3",1,"Fully Open Access","Available in electronic format only. Open Access. "
"Nano Research","Nano Research","PE OF",12274,"1998-0124","1998-0000","Tsinghua University Press, co-published with Springer","English",1,"9",12,"Hybrid (Open Choice)","Chinese Library of Science. Exclusive distribution rights for print version outside Mainland China, for electronic version worldwide. "
"NanoEthics","NanoEthics","PE OF",11569,"1871-4757","1871-4765","Springer","English",1,"10",3,"Hybrid (Open Choice)",
"Nano-Micro Letters","Nano-Micro Letters","E OA OF",40820,,"2150-5551","Springer","English",1,"8",4,"Fully Open Access","Chinese Library of Science. Available in electronic format only. Open Access. "
"Nanoscale Research Letters","Nanoscale Research Letters","E OA C",11671,,"1556-276X","Springer","English",1,"11",1,"Fully Open Access","Available in electronic format only. Open Access. "
"Nanotechnologies Russia","Nanotechnologies in Russia","PE",12201,"1995-0780","1995-0799","MAIK Nauka/Interperiodica","English",1,"11",12,,"Erratum Journals List: Publishes 12 issues in 2016. Russian Library of Science. "
"Nanotechnology Environmental Engineering","Nanotechnology for Environmental Engineering","PE C",41204,"2365-6379","2365-6387","Springer","English",1,"1",1,"Hybrid (Open Choice)","Addendum Journals List: New Start in 2016. "
"National Academy Science Letters","National Academy Science Letters","PE OF",40009,"0250-541X","2250-1754","Springer","English",1,"39",6,"Hybrid (Open Choice)",
"Natur Recht","Natur und Recht","PE",10357,"0172-1631","1439-0515","Springer","German",1,"38",12,"Hybrid (Open Choice)",
"Natural Computing","Natural Computing","E OF S",11047,,"1572-9796","Springer","English",1,"15",4,"Hybrid (Open Choice)","Available in electronic format only. "
"Natural Hazards","Natural Hazards","PE",11069,"0921-030X","1573-0840","Springer","English",5,"80-84",3,"Hybrid (Open Choice)",
