"Current Psychiatry Reports","Current Psychiatry Reports","E S C",11920,,"1535-1645","Springer","English",1,"18",12,"Hybrid (Open Choice)","Available in electronic format only. "
"Current Psychology","Current Psychology","PE OF",12144,"1046-1310","1936-4733","Springer","English",1,"35",4,"Hybrid (Open Choice)",
"Current Pulmonology Reports","Current Pulmonology Reports","E OF S",13665,,"2199-2428","Springer","English",1,"5",4,"Hybrid (Open Choice)","Available in electronic format only. "
"Current Radiology Reports","Current Radiology Reports","E S C",40134,,"2167-4825","Springer","English",1,"4",12,"Hybrid (Open Choice)","Available in electronic format only. "
"Current Reviews Musculoskeletal Medicine","Current Reviews in Musculoskeletal Medicine","E OF S",12178,,"1935-9748","Springer","English",1,"9",4,"Hybrid (Open Choice)","Available in electronic format only. "
"Current Rheumatology Reports","Current Rheumatology Reports","E S C",11926,,"1534-6307","Springer","English",1,"18",12,"Hybrid (Open Choice)","Available in electronic format only. "
"Current Sexual Health Reports","Current Sexual Health Reports","E OF S",11930,,"1548-3592","Springer","English",1,"8",4,"Hybrid (Open Choice)","Available in electronic format only. "
"Current Sleep Medicine Reports","Current Sleep Medicine Reports","E OF S",40675,,"2198-6401","Springer","English",1,"2",4,"Hybrid (Open Choice)","Available in electronic format only. "
"Current Stem Cell Reports","Current Stem Cell Reports","E OF S",40778,,"2198-7866","Springer","English",1,"2",4,"Hybrid (Open Choice)","Available in electronic format only. "
"Current Surgery Reports","Current Surgery Reports","E S C",40137,,"2167-4817","Springer","English",1,"4",12,"Hybrid (Open Choice)","Available in electronic format only. "
"Current Sustainable/Renewable Energy Reports","Current Sustainable/Renewable Energy Reports","E OF S",40518,,"2196-3010","Springer","English",1,"3",4,"Hybrid (Open Choice)","Available in electronic format only. "
"Current Transplantation Reports","Current Transplantation Reports","E OF S",40472,,"2196-3029","Springer","English",1,"3",4,"Hybrid (Open Choice)","Available in electronic format only. "
"Current Trauma Reports","Current Trauma Reports","E OF S",40719,,"2198-6096","Springer","English",1,"2",4,"Hybrid (Open Choice)","Available in electronic format only. "
"Current Treatment Options Allergy","Current Treatment Options in Allergy","E OF S",40521,,"2196-3053","Springer","English",1,"3",4,"Hybrid (Open Choice)","Available in electronic format only. "
"Current Treatment Options Cardiovascular Medicine","Current Treatment Options in Cardiovascular Medicine","E S C",11936,,"1534-3189","Springer","English",1,"18",12,"Hybrid (Open Choice)","Available in electronic format only. "
"Current Treatment Options Gastroenterology","Current Treatment Options in Gastroenterology","E OF S",11938,,"1534-309X","Springer","English",1,"14",4,"Hybrid (Open Choice)","Available in electronic format only. "
"Current Treatment Options Infectious Diseases","Current Treatment Options in Infectious Diseases","E OF S",40506,,"1534-6250","Springer","English",1,"8",4,"Hybrid (Open Choice)","Available in electronic format only. "
"Current Treatment Options Neurology","Current Treatment Options in Neurology","E S C",11940,,"1534-3138","Springer","English",1,"18",12,"Hybrid (Open Choice)","Available in electronic format only. "
"Current Treatment Options Oncology","Current Treatment Options in Oncology","E S C",11864,,"1534-6277","Springer","English",1,"17",12,"Hybrid (Open Choice)","Available in electronic format only. "
"Current Treatment Options Pediatrics","Current Treatment Options in Pediatrics","E OF S",40746,,"2198-6088","Springer","English",1,"2",4,"Hybrid (Open Choice)","Available in electronic format only. "
"Current Treatment Options Psychiatry","Current Treatment Options in Psychiatry","E OF S",40501,,"2196-3061","Springer","English",1,"3",4,"Hybrid (Open Choice)","Available in electronic format only. "
"Current Treatment Options Rheumatology","Current Treatment Options in Rheumatology","E OF S",40674,,"2198-6002","Springer","English",1,"2",4,"Hybrid (Open Choice)","Available in electronic format only. "
"Current Tropical Medicine Reports","Current Tropical Medicine Reports","E OF S",40475,,"2196-3045","Springer","English",1,"3",4,"Hybrid (Open Choice)","Available in electronic format only. "
"Current Urology Reports","Current Urology Reports","E S C",11934,,"1534-6285","Springer","English",1,"17",12,"Hybrid (Open Choice)","Available in electronic format only. "
"Customer Needs Solutions","Customer Needs and Solutions","PE",40547,"2196-291X","2196-2928","Springer","English",1,"3",4,"Hybrid (Open Choice)",
"Cybernetics Systems Analysis","Cybernetics and Systems Analysis","PE",10559,"1060-0396","1573-8337","Springer","English",1,"52",6,,"Russian Library of Science. "
"Cytology Genetics","Cytology and Genetics","PE",11956,"0095-4527","1934-9440","Allerton Press","English",1,"50",6,,"Russian Library of Science. "
"Cytotechnology","Cytotechnology","PE OF",10616,"0920-9069","1573-0778","Springer","English",1,"68",6,"Hybrid (Open Choice)",
"Czechoslovak Mathematical Journal","Czechoslovak Mathematical Journal","PE",10587,"0011-4642","1572-9141","Springer","English",1,"66",4,,
"Dairy Science Technology","Dairy Science & Technology","PE OF",13594,"1958-5586","1958-5594","Springer","English",1,"96",6,"Hybrid (Open Choice)",
"Dao","Dao","PE OF",11712,"1540-3009","1569-7274","Springer","English",1,"15",4,"Hybrid (Open Choice)",
"DARU Journal Pharmaceutical Sciences","DARU Journal of Pharmaceutical Sciences","E OA C",40199,,"2008-2231","BioMed Central","English",1,"24",1,"Fully Open Access","Available in electronic format only. Open Access. "
"Data Mining Knowledge Discovery","Data Mining and Knowledge Discovery","PE OF",10618,"1384-5810","1573-756X","Springer","English",1,"30",6,"Hybrid (Open Choice)",
"Data Science Engineering","Data Science and Engineering","E OA",41019,,"2364-1541","Springer","English",1,"1",4,"Fully Open Access","New Start, content expected in 2016. Available in electronic format only. Open Access. "
"Datenbank-Spektrum","Datenbank-Spektrum","PE OF",13222,"1618-2162","1610-1995","Springer","German",1,"16",3,"Hybrid (Open Choice)",
"Datenschutz Datensicherheit DuD","Datenschutz und Datensicherheit - DuD","PE",11623,"1614-0702","1862-2607","Springer Gabler","German",1,"40",12,,"Electronic version available on springerprofessional.de and link.springer.com. "
"De Economist","De Economist","PE OF",10645,"0013-063X","1572-9982","Springer","English",1,"164",4,"Hybrid (Open Choice)",
"DECISION","DECISION","PE OF",40622,"0304-0941","2197-1722","Springer","English",1,"43",4,"Hybrid (Open Choice)",
"Decision Analytics","Decision Analytics","E OA C",40165,,"2193-8636","Springer","English",1,"3",1,"Fully Open Access","Available in electronic format only. Open Access. "
"Decisions Economics Finance","Decisions in Economics and Finance","PE OF",10203,"1593-8883","1129-6569","Springer","English",1,"39",2,"Hybrid (Open Choice)",
"Demography","Demography","PE OF",13524,"0070-3370","1533-7790","Springer","English",1,"53",6,"Hybrid (Open Choice)",
"Denkbeeld","Denkbeeld","PE",12428,"0926-7182","1876-5653","Bohn Stafleu van Loghum","Dutch",1,"28",6,,"Order through Bohn Stafleu van Loghum. "
"der junge zahnarzt","der junge zahnarzt","PE OF S",13279,"1869-5744","1869-5752","SpringerMedizin","German",1,"7",4,,
"Dermatology Therapy","Dermatology and Therapy","E OA OF S",13555,,"2190-9172","Adis","English",1,"6",4,"Fully Open Access","Available in electronic format only. Open Access. "
"Design Automation Embedded Systems","Design Automation for Embedded Systems","PE OF",10617,"0929-5585","1572-8080","Springer","English",1,"20",4,"Hybrid (Open Choice)",
"Designs Codes Cryptography","Designs, Codes and Cryptography","PE OF",10623,"0925-1022","1573-7586","Springer","English",4,"78-81",3,"Hybrid (Open Choice)",
"Deutsche Dermatologe","Der Deutsche Dermatologe","P",15011,"0340-8078",,"SpringerMedizin","German",1,"64",12,,"Not available in electronic format. "
"Deutsche Vierteljahrsschrift Literaturwissenschaft Geistesgeschichte","Deutsche Vierteljahrsschrift für Literaturwissenschaft und Geistesgeschichte","PE",41245,"0012-0936","2365-9521","J.B. Metzler","German",1,"90",4,,"Addendum Journals List: Publisher Merger as of 2016, print only. "
"Development Genes Evolution","Development Genes and Evolution","PE OF S",427,"0949-944X","1432-041X","Springer","English",1,"226",6,"Hybrid (Open Choice)",
"Diabetes Therapy","Diabetes Therapy","E OA OF S",13300,,"1869-6961","Adis","English",1,"7",4,"Fully Open Access","Available in electronic format only. Open Access. "
"Diabetologe","Der Diabetologe","PE OF S",11428,"1860-9716","1860-9724","SpringerMedizin","German",1,"12",8,"Hybrid (Open Choice)",
"Diabetologia","Diabetologia","PE OF",125,"0012-186X","1432-0428","Springer","English",1,"59",12,"Hybrid (Open Choice)",
"Diabetology International","Diabetology International","PE",13340,"2190-1678","2190-1686","Springer","English",1,"7",4,,
"Diabetology Metabolic Syndrome","Diabetology & Metabolic Syndrome","E OA C",13098,,"1758-5996","BioMed Central","English",1,"8",1,"Fully Open Access","Available in electronic format only. Open Access. "
"Diagnostic Pathology","Diagnostic Pathology","E OA C",13000,,"1746-1596","BioMed Central","English",1,"11",1,"Fully Open Access","Available in electronic format only. Open Access. "
"Dialectical Anthropology","Dialectical Anthropology","PE OF",10624,"0304-4092","1573-0786","Springer","English",1,"40",4,"Hybrid (Open Choice)",
"Differential Equations","Differential Equations","PE",10625,"0012-2661","1608-3083","MAIK Nauka/Interperiodica","English",1,"52",13,,"Russian Library of Science. "
"Differential Equations Dynamical Systems","Differential Equations and Dynamical Systems","PE OF",12591,"0971-3514","0974-6870","Springer","English",1,"24",4,,
"Digestive Diseases Sciences","Digestive Diseases and Sciences","PE OF",10620,"0163-2116","1573-2568","Springer","English",1,"61",12,"Hybrid (Open Choice)",
"Digital Experiences Mathematics Education","Digital Experiences in Mathematics Education","PE",40751,"2199-3246","2199-3254","Springer","English",1,"2",3,"Hybrid (Open Choice)",
"Disaster Military Medicine","Disaster and Military Medicine","E OA C",40696,,"2054-314X","BioMed Central","English",1,"2",1,"Fully Open Access","Available in electronic format only. Open Access. "
"Discrete Computational Geometry","Discrete & Computational Geometry","PE OF",454,"0179-5376","1432-0444","Springer","English",2,"55-56",4,"Hybrid (Open Choice)",
"Discrete Event Dynamic Systems","Discrete Event Dynamic Systems","PE OF",10626,"0924-6703","1573-7594","Springer","English",1,"26",4,"Hybrid (Open Choice)",
"Distributed Computing","Distributed Computing","PE OF",446,"0178-2770","1432-0452","Springer","English",1,"29",6,"Hybrid (Open Choice)",
"Distributed Parallel Databases","Distributed and Parallel Databases","PE OF",10619,"0926-8782","1573-7578","Springer","English",1,"34",4,"Hybrid (Open Choice)",
"DNP Neurologe Psychiater","DNP - Der Neurologe und Psychiater","PE",15202,"1616-2455","2196-6427","SpringerMedizin","German",1,"17",12,,"Available on link.springer.com and springermedizin.de. "
"Documenta Ophthalmologica","Documenta Ophthalmologica","PE OF S",10633,"0012-4486","1573-2622","Springer","English",2,"132-133",3,"Hybrid (Open Choice)",
"Doklady Biochemistry Biophysics","Doklady Biochemistry and Biophysics","PE",10628,"1607-6729","1608-3091","MAIK Nauka/Interperiodica","English",6,"466-471",1,,"Russian Library of Science. "
"Doklady Biological Sciences","Doklady Biological Sciences","PE",10630,"0012-4966","1608-3105","MAIK Nauka/Interperiodica","English",6,"466-471",1,,"Russian Library of Science. "
"Doklady Chemistry","Doklady Chemistry","PE",10631,"0012-5008","1608-3113","MAIK Nauka/Interperiodica","English",6,"466-471",2,,"Russian Library of Science. "
"Doklady Earth Sciences","Doklady Earth Sciences","PE",11471,"1028-334X","1531-8354","MAIK Nauka/Interperiodica","English",6,"466-471",2,,"Russian Library of Science. "
"Doklady Mathematics","Doklady Mathematics","PE",11472,"1064-5624","1531-8362","MAIK Nauka/Interperiodica","English",2,"93-94",3,,"Russian Library of Science. "
"Doklady Physical Chemistry","Doklady Physical Chemistry","PE",10634,"0012-5016","1608-3121","MAIK Nauka/Interperiodica","English",6,"466-471",2,,"Russian Library of Science. "
"Doklady Physics","Doklady Physics","PE",11446,"1028-3358","1562-6903","MAIK Nauka/Interperiodica","English",1,"61",12,,"Russian Library of Science. "
"Douleur Analgésie","Douleur et Analgésie","E OF",11724,,"1951-6398","Lavoisier","French",1,"29",4,"Hybrid (Open Choice)","Springerlink licensing permitted (last year 2016). Print and online subscriptions available from Lavoisier. "
"Drug Delivery Translational Research","Drug Delivery and Translational Research","PE OF",13346,"2190-393X","2190-3948","Springer","English",1,"6",6,"Hybrid (Open Choice)",
"Drug Safety","Drug Safety","PE OF",40264,"0114-5916","1179-1942","Adis","English",1,"39",12,"Hybrid (Open Choice)",
"Drug Safety Case Reports","Drug Safety - Case Reports","E OA OF C",40800,,"2198-977X","Adis","English",1,"3",1,"Fully Open Access","Available in electronic format only. Open Access. "
"Drugs","Drugs","PE OF",40265,"0012-6667","1179-1950","Adis","English",1,"76",18,"Hybrid (Open Choice)",
"Drugs Aging","Drugs & Aging","PE OF",40266,"1170-229X","1179-1969","Adis","English",1,"33",12,"Hybrid (Open Choice)",
"Drugs R&D","Drugs in R&D","E OA OF",40268,,"1179-6901","Adis","English",1,"16",4,"Fully Open Access","Available in electronic format only. Open Access. "
"Drugs Real World Outcomes","Drugs - Real World Outcomes","E OA OF",40801,,"2198-9788","Adis","English",1,"3",4,"Fully Open Access","Available in electronic format only. Open Access. "
"Drugs Therapy Perspectives","Drugs & Therapy Perspectives","PE OF",40267,"1172-0360","1179-1977","Adis","English",1,"32",12,"Hybrid (Open Choice)",
"Dynamic Games Applications","Dynamic Games and Applications","PE OF S",13235,"2153-0785","2153-0793","Birkhäuser","English",1,"6",4,"Hybrid (Open Choice)",
"Dysphagia","Dysphagia","PE OF",455,"0179-051X","1432-0460","Springer","English",1,"31",6,"Hybrid (Open Choice)",
"e Elektrotechnik Informationstechnik","e & i Elektrotechnik und Informationstechnik","PE OF",502,"0932-383X","1613-7620","Springer","German",1,"133",8,"Hybrid (Open Choice)","Order through Springer Vienna. Special price for postage & handling for customers in Austria. "
"Early Childhood Education Journal","Early Childhood Education Journal","PE OF",10643,"1082-3301","1573-1707","Springer","English",1,"44",6,"Hybrid (Open Choice)",
"Earth Moon Planets","Earth, Moon, and Planets","PE OF S",11038,"0167-9295","1573-0794","Springer","English",2,"118-119",3,"Hybrid (Open Choice)",
"Earth Perspectives","Earth Perspectives","E OA C",40322,,"2194-6434","Springer","English",1,"3",1,"Fully Open Access","Available in electronic format only. Open Access. "
"Earth Planets Space","Earth, Planets and Space","E OA C",40623,,"1880-5981","Springer","English",1,"68",1,"Fully Open Access","Available in electronic format only. Open Access. "
"Earth Science Informatics","Earth Science Informatics","PE OF",12145,"1865-0473","1865-0481","Springer","English",1,"9",4,"Hybrid (Open Choice)",
"Earthquake Engineering Engineering Vibration","Earthquake Engineering and Engineering Vibration","PE",11803,"1671-3664","1993-503X","Institute of Engineering Mechanics, China Earthquake Administration, co-published with Springer","English",1,"15",4,,"Chinese Library of Science. Exclusive distribution rights for print version outside Mainland China, for electronic version worldwide. "
"Earthquake Science","Earthquake Science","E OA",11589,,"1867-8777","Seismological Society of China, co-published with Springer","English",1,"29",6,"Fully Open Access","Chinese Library of Science. Exclusive distribution rights for print version outside Mainland China, for electronic version worldwide. Available in electronic format only. Open Access. "
"East Asia","East Asia","PE OF",12140,"1096-6838","1874-6284","Springer","English",1,"33",4,"Hybrid (Open Choice)",
"Eating Weight Disorders Studies Anorexia Bulimia Obesity","Eating and Weight Disorders - Studies on Anorexia, Bulimia and Obesity","E OF S",40519,,"1590-1262","Springer","English",1,"21",4,"Hybrid (Open Choice)","Available in electronic format only. "
"EcoHealth","EcoHealth","PE OF S",10393,"1612-9202","1612-9210","Springer","English",1,"13",4,"Hybrid (Open Choice)",
"Ecological Processes","Ecological Processes","E OA C",13717,,"2192-1709","Springer","English",1,"5",1,"Fully Open Access","Available in electronic format only. Open Access. "
"Ecological Research","Ecological Research","PE OF S",11284,"0912-3814","1440-1703","Springer","English",1,"31",6,"Hybrid (Open Choice)",
"Economia Politica","Economia Politica","PE OF",40888,"1120-2890","1973-820X","Springer","English",1,"33",3,"Hybrid (Open Choice)",
"Economia Politica Industriale","Economia e Politica Industriale","PE OF",40812,"0391-2078","1972-4977","Springer","English",1,"43",4,"Hybrid (Open Choice)",
"Economic Botany","Economic Botany","PE OF S",12231,"0013-0001","1874-9364","Springer","English",1,"70",4,"Hybrid (Open Choice)",
"Economic Change Restructuring","Economic Change and Restructuring","PE OF",10644,"1573-9414","1574-0277","Springer","English",1,"49",4,"Hybrid (Open Choice)",
"Economic Theory","Economic Theory","PE OF",199,"0938-2259","1432-0479","Springer","English",2,"61-62",4,"Hybrid (Open Choice)",
"Economic Theory Bulletin","Economic Theory Bulletin","E OF S",40505,,"2196-1093","Springer","English",1,"4",2,"Hybrid (Open Choice)","Available in electronic format only. "
"Economics Governance","Economics of Governance","PE OF",10101,"1435-6104","1435-8131","Springer","English",1,"17",4,"Hybrid (Open Choice)",
"Ecosystems","Ecosystems","PE OF S",10021,"1432-9840","1435-0629","Springer","English",1,"19",8,"Hybrid (Open Choice)",
"Ecotoxicology","Ecotoxicology","PE",10646,"0963-9292","1573-3017","Springer","English",1,"25",10,"Hybrid (Open Choice)",
"Education Information Technologies","Education and Information Technologies","PE OF",10639,"1360-2357","1573-7608","Springer","English",1,"21",6,"Hybrid (Open Choice)",
"Educational Assessment Evaluation Accountability","Educational Assessment, Evaluation and Accountability","PE OF",11092,"1874-8597","1874-8600","Springer","English",1,"28",4,"Hybrid (Open Choice)",
"Educational Psychology Review","Educational Psychology Review","PE OF",10648,"1040-726X","1573-336X","Springer","English",1,"28",4,"Hybrid (Open Choice)",
"Educational Research Policy Practice","Educational Research for Policy and Practice","PE OF",10671,"1570-2081","1573-1723","Springer","English",1,"15",3,"Hybrid (Open Choice)",
"Educational Studies Mathematics","Educational Studies in Mathematics","PE OF",10649,"0013-1954","1573-0816","Springer","English",3,"91-93",3,"Hybrid (Open Choice)",
"Educational Technology Research Development","Educational Technology Research and Development","PE OF",11423,"1042-1629","1556-6501","Springer","English",1,"64",6,"Hybrid (Open Choice)",
"EJNMMI Physics","EJNMMI Physics","E OA C",40658,,"2197-7364","Springer","English",1,"3",1,"Fully Open Access","Available in electronic format only. Open Access. "
"EJNMMI Radiopharmacy Chemistry","EJNMMI Radiopharmacy and Chemistry","E OA C",41181,,"2365-421X","Springer","English",1,"1",1,"Fully Open Access","Addendum Journals List: New Start in 2016. Available in electronic format only. Open Access. "
"EJNMMI Research","EJNMMI Research","E OA C",13550,,"2191-219X","Springer","English",1,"6",1,"Fully Open Access","Available in electronic format only. Open Access. "
"Electrical Engineering","Electrical Engineering","PE OF",202,"0948-7921","1432-0487","Springer","English",1,"98",4,"Hybrid (Open Choice)",
"Electrocatalysis","Electrocatalysis","PE OF",12678,"1868-2529","1868-5994","Springer","English",1,"7",6,"Hybrid (Open Choice)",
"Electronic Commerce Research","Electronic Commerce Research","PE OF",10660,"1389-5753","1572-9362","Springer","English",1,"16",4,"Hybrid (Open Choice)",
"Electronic Markets","Electronic Markets","PE OF",12525,"1019-6781","1422-8890","Springer","English",1,"26",4,"Hybrid (Open Choice)",
"Electronic Materials Letters","Electronic Materials Letters","PE",13391,"1738-8090","2093-6788","The Korean Institute of Metals and Materials, co-published with Springer","English",1,"12",6,,"Springer has the exclusive distribution rights for print version outside Korea, for electronic version worldwide. "
"Emergency Radiology","Emergency Radiology","PE OF",10140,"1070-3004","1438-1435","Springer","English",1,"23",6,"Hybrid (Open Choice)",
"Emerging Themes Epidemiology","Emerging Themes in Epidemiology","E OA C",12982,,"1742-7622","BioMed Central","English",1,"13",1,"Fully Open Access","Available in electronic format only. Open Access. "
"Emission Control Science Technology","Emission Control Science and Technology","PE OF S",40825,"2199-3629","2199-3637","Springer","English",1,"2",4,"Hybrid (Open Choice)",
"Empirica","Empirica","PE OF",10663,"0340-8744","1573-6911","Springer","English",1,"43",4,"Hybrid (Open Choice)",
"Empirical Economics","Empirical Economics","PE OF S",181,"0377-7332","1435-8921","Springer","English",2,"50-51",4,"Hybrid (Open Choice)",
"Empirical Research Vocational Education Training","Empirical Research in Vocational Education and Training","E OA C",40461,,"1877-6345","Springer","English",1,"8",1,"Fully Open Access","Available in electronic format only. Open Access. "
"Empirical Software Engineering","Empirical Software Engineering","PE OF",10664,"1382-3256","1573-7616","Springer","English",1,"21",6,"Hybrid (Open Choice)",
"Employee Responsibilities Rights Journal","Employee Responsibilities and Rights Journal","PE OF",10672,"0892-7545","1573-3378","Springer","English",1,"28",4,"Hybrid (Open Choice)",
"Endocrine","Endocrine","PE OF",12020,"1355-008X","1559-0100","Springer","English",4,"51-54",3,"Hybrid (Open Choice)",
"Endocrine Pathology","Endocrine Pathology","PE OF",12022,"1046-3976","1559-0097","Springer","English",1,"27",4,"Hybrid (Open Choice)",
"Energy Ecology Environment","Energy, Ecology and Environment","E OF",40974,,"2363-8338","Joint Center on Global Change and Earth System Science of the University of Maryland and Beijing Normal University, co-published with Springer","English",1,"1",6,"Hybrid (Open Choice)","Erratum Journals List: Start postponed to 2016. Chinese Library of Science. Available in electronic format only. "
"Energy Efficiency","Energy Efficiency","PE OF S",12053,"1570-646X","1570-6478","Springer","English",1,"9",6,"Hybrid (Open Choice)",
"Energy Sustainability Society","Energy, Sustainability and Society","E OA S C",13705,,"2192-0567","Springer","English",1,"6",1,"Fully Open Access","Available in electronic format only. Open Access. "
"Energy Systems","Energy Systems","PE OF",12667,"1868-3967","1868-3975","Springer","English",1,"7",4,"Hybrid (Open Choice)",
"e-Neuroforum","e-Neuroforum","E",13295,,"1868-856X","Springer Spektrum","English",1,"7",4,"Hybrid (Open Choice)","Available in electronic format only. "
"Engineering with Computers","Engineering with Computers","PE OF",366,"0177-0667","1435-5663","Springer","English",1,"32",4,"Hybrid (Open Choice)",
"Entomological Review","Entomological Review","PE",11474,"0013-8738","1555-6689","MAIK Nauka/Interperiodica","English",1,"96",9,,"Russian Library of Science. "
"Environment Development Sustainability","Environment, Development and Sustainability","PE",10668,"1387-585X","1573-2975","Springer","English",1,"18",6,"Hybrid (Open Choice)",
"Environment Systems Decisions","Environment Systems and Decisions","PE OF",10669,"2194-5403","2194-5411","Springer","English",1,"36",4,"Hybrid (Open Choice)",
"Environmental Biology Fishes","Environmental Biology of Fishes","PE OF S",10641,"0378-1909","1573-5133","Springer","English",1,"99",12,"Hybrid (Open Choice)",
"Environmental Chemistry Letters","Environmental Chemistry Letters","PE OF S",10311,"1610-3653","1610-3661","Springer","English",1,"14",4,"Hybrid (Open Choice)",
"Environmental Earth Sciences","Environmental Earth Sciences","PE S C",12665,"1866-6280","1866-6299","Springer","English",1,"75",24,"Hybrid (Open Choice)",
"Environmental Ecological Statistics","Environmental and Ecological Statistics","PE OF",10651,"1352-8505","1573-3009","Springer","English",1,"23",4,"Hybrid (Open Choice)",
"Environmental Economics Policy Studies","Environmental Economics and Policy Studies","PE OF",10018,"1432-847X","1867-383X","Springer","English",1,"18",4,"Hybrid (Open Choice)",
"Environmental Evidence","Environmental Evidence","E OA C",13750,,"2047-2382","BioMed Central","English",1,"5",1,"Fully Open Access","Available in electronic format only. Open Access. "
"Environmental Fluid Mechanics","Environmental Fluid Mechanics","PE",10652,"1567-7419","1573-1510","Springer","English",1,"16",6,"Hybrid (Open Choice)",
"Environmental Geochemistry Health","Environmental Geochemistry and Health","PE OF S",10653,"0269-4042","1573-2983","Springer","English",1,"38",6,"Hybrid (Open Choice)",
"Environmental Health","Environmental Health","E OA C",12940,,"1476-069X","BioMed Central","English",1,"15",1,"Fully Open Access","Available in electronic format only. Open Access. "
"Environmental Health Preventive Medicine","Environmental Health and Preventive Medicine","PE OF S",12199,"1342-078X","1347-4715","Springer","English",1,"21",6,"Hybrid (Open Choice)",
"Environmental Management","Environmental Management","PE OF",267,"0364-152X","1432-1009","Springer","English",2,"57-58",6,"Hybrid (Open Choice)",
